{"$schema":"https://json-schema.org/draft/2020-12/schema","$id":"https://simplevtt.local/schemas/rules-profile.schema.json","title":"SimpleVTT RulesProfile","type":"object","required":["schemaVersion","profileId","profileVersion","source","defaultLocale","roundingPolicy","properties","proficiency","d20Test","predicateOperators","timingPoints","initiativePolicy","acPolicy","economy","damagePolicy","hpPolicy","progression","activities","activationStates","contentCategories","capabilities"],"properties":{"schemaVersion":{"const":"0.1-draft"},"profileId":{"type":"string","pattern":"^[a-z0-9][a-z0-9._-]*$"},"profileVersion":{"type":"string","minLength":1},"source":{"type":"object","required":["document","version","published","license","urls"],"properties":{"document":{"type":"string"},"version":{"type":"string"},"published":{"type":"string","format":"date"},"license":{"type":"string"},"urls":{"type":"array","minItems":1,"items":{"type":"string","format":"uri"}}},"additionalProperties":false},"defaultLocale":{"type":"string","pattern":"^[a-z]{2}(?:-[A-Z]{2})?$"},"roundingPolicy":{"type":"object","required":["id","default"],"properties":{"id":{"type":"string"},"default":{"enum":["floor","ceil","round"]}},"additionalProperties":false},"properties":{"type":"object","minProperties":1,"additionalProperties":{"$ref":"#/$defs/propertyDefinition"}},"proficiency":{"type":"object","required":["characterLevelThresholds","multipliers","repeatSameBonus"],"properties":{"characterLevelThresholds":{"type":"array","minItems":1,"items":{"type":"object","required":["minLevel","maxLevel","bonus"],"properties":{"minLevel":{"type":"integer","minimum":1},"maxLevel":{"type":"integer","minimum":1},"bonus":{"type":"integer","minimum":0}},"additionalProperties":false}},"multipliers":{"type":"array","uniqueItems":true,"items":{"type":"number","minimum":0}},"repeatSameBonus":{"type":"boolean"}},"additionalProperties":false},"d20Test":{"type":"object","required":["families","rollStates","advantageDisadvantage"],"properties":{"families":{"type":"array","uniqueItems":true,"items":{"enum":["ability-check","saving-throw","attack-roll"]}},"rollStates":{"type":"array","uniqueItems":true,"items":{"enum":["normal","advantage","disadvantage"]}},"advantageDisadvantage":{"type":"object","required":["sameSideStacks","opposingCancel","defaultDiceCount"],"properties":{"sameSideStacks":{"type":"boolean"},"opposingCancel":{"type":"boolean"},"defaultDiceCount":{"type":"integer","minimum":1}},"additionalProperties":false}},"additionalProperties":false},"predicateOperators":{"type":"array","minItems":1,"uniqueItems":true,"items":{"type":"string","minLength":1}},"timingPoints":{"type":"array","minItems":1,"uniqueItems":true,"items":{"type":"string","minLength":1}},"initiativePolicy":{"type":"object","required":["ability","order","tieResolution","surpriseRollState"],"properties":{"ability":{"const":"dex"},"order":{"const":"descending"},"tieResolution":{"const":"explicit-choice"},"surpriseRollState":{"const":"disadvantage"}},"additionalProperties":false},"acPolicy":{"type":"object","required":["property","formulaResolution","loadOrderOverrides"],"properties":{"property":{"const":"defense.ac"},"formulaResolution":{"const":"select-valid-candidate-then-apply-compatible-modifiers"},"loadOrderOverrides":{"const":false}},"additionalProperties":false},"economy":{"$ref":"#/$defs/economy"},"damagePolicy":{"$ref":"#/$defs/damagePolicy"},"hpPolicy":{"$ref":"#/$defs/hpPolicy"},"progression":{"$ref":"#/$defs/progression"},"activities":{"type":"object","required":["shortRest","longRest"],"properties":{"shortRest":{"$ref":"#/$defs/activity"},"longRest":{"$ref":"#/$defs/activity"}},"additionalProperties":false},"activationStates":{"type":"array","uniqueItems":true,"items":{"type":"string","minLength":1}},"contentCategories":{"type":"array","uniqueItems":true,"items":{"type":"string","minLength":1}},"damageTypes":{"type":"array","uniqueItems":true,"items":{"type":"string","minLength":1}},"capabilities":{"type":"array","minItems":1,"uniqueItems":true,"items":{"type":"string","minLength":1}},"$schema":{"type":"string","format":"uri"},"propertyModifierPolicy":{"type":"object","required":["defaultInstancePolicy"],"properties":{"defaultInstancePolicy":{"enum":["stack","replace","unique-by-source"]}},"additionalProperties":false}},"additionalProperties":false,"$defs":{"expression":{"oneOf":[{"type":"object","required":["value"],"properties":{"value":{"type":["number","integer","boolean","string"]}},"additionalProperties":false},{"type":"object","required":["ref"],"properties":{"ref":{"type":"string","minLength":1}},"additionalProperties":false},{"type":"object","required":["op","args"],"properties":{"op":{"enum":["add","subtract","multiply","divide","min","max","floor","ceil"]},"args":{"type":"array","minItems":1,"items":{"$ref":"#/$defs/expression"}}},"additionalProperties":false}]},"propertyDefinition":{"type":"object","required":["type","storage"],"properties":{"type":{"enum":["integer","number","boolean","string"]},"storage":{"enum":["stored","derived","context"]},"formula":{"$ref":"#/$defs/expression"},"minimum":{"type":"number"},"maximum":{"type":"number"}},"additionalProperties":false},"economy":{"type":"object","required":["initiativeBuckets","freeformPolicy"],"properties":{"initiativeBuckets":{"type":"object","minProperties":1,"additionalProperties":{"$ref":"#/$defs/economyBucket"}},"grantBuckets":{"type":"object","additionalProperties":{"$ref":"#/$defs/economyGrantBucket"}},"freeformPolicy":{"type":"object","required":["turnLimitedSpendPersistence","realResourcesPersistent","bucketPolicies"],"properties":{"turnLimitedSpendPersistence":{"const":"none"},"realResourcesPersistent":{"const":true},"bucketPolicies":{"type":"object","additionalProperties":{"enum":["untracked","per-activity","time-window","unavailable"]}}},"additionalProperties":false}},"additionalProperties":false},"economyBucket":{"type":"object","required":["kind","resetTiming"],"properties":{"kind":{"enum":["count","budget"]},"capacity":{"type":"integer","minimum":0},"capacityRef":{"type":"string","minLength":1},"resetTiming":{"type":"string","minLength":1},"resetOwner":{"enum":["actor","owner"]},"availability":{"enum":["always","granted-option-required","trigger-required"]}},"additionalProperties":false,"oneOf":[{"required":["capacity"]},{"required":["capacityRef"]}]},"economyGrantBucket":{"type":"object","required":["kind","allowsMagicAction"],"properties":{"kind":{"const":"extra-action"},"allowsMagicAction":{"type":"boolean"},"activeTurnOnly":{"type":"boolean"}},"additionalProperties":false},"damagePolicy":{"type":"object","required":["componentOrder","immunityStage","duplicateResistanceStacks","duplicateVulnerabilityStacks","critical"],"properties":{"componentOrder":{"type":"array","items":{"enum":["adjustments","resistance","vulnerability"]}},"immunityStage":{"const":"before-final-application"},"duplicateResistanceStacks":{"type":"boolean"},"duplicateVulnerabilityStacks":{"type":"boolean"},"critical":{"type":"object","required":["eligibleDiceMultiplier","flatModifierMultiplier"],"properties":{"eligibleDiceMultiplier":{"type":"integer","minimum":1},"flatModifierMultiplier":{"type":"integer","minimum":1}},"additionalProperties":false}},"additionalProperties":false},"hpPolicy":{"type":"object","required":["temporaryHp"],"properties":{"temporaryHp":{"type":"object","required":["absorbsBeforeHp","stacksByDefault","competingGrantPolicy","isHealing"],"properties":{"absorbsBeforeHp":{"type":"boolean"},"stacksByDefault":{"type":"boolean"},"competingGrantPolicy":{"const":"keep-or-replace-choice"},"isHealing":{"type":"boolean"}},"additionalProperties":false}},"additionalProperties":false},"progression":{"type":"object","required":["characterLevel","characterTrack","classTrackPattern"],"properties":{"characterLevel":{"type":"object","required":["min","max"],"properties":{"min":{"type":"integer"},"max":{"type":"integer"}},"additionalProperties":false},"characterTrack":{"type":"string","minLength":1},"classTrackPattern":{"type":"string","minLength":1}},"additionalProperties":false},"activity":{"type":"object","required":["id","completedTiming"],"properties":{"id":{"type":"string","minLength":1},"completedTiming":{"type":"string","minLength":1}},"additionalProperties":false}}}